{
  "lockVersion": "weftext.docling-lite-assets.v1",
  "doclingReleaseTag": "v0.52.2",
  "doclingReleaseCommit": "ca9fe7a543b55a540dfa18b88f4f44591b5a928e",
  "documentSchemaName": "DoclingDocument",
  "documentSchemaVersion": "1.10.0",
  "profile": "pdfium-layout-int8-ppocrv3-en",
  "target": "x86_64-unknown-linux-gnu",
  "network": "denied",
  "noTableFormer": true,
  "ocrLanguage": "en",
  "totalPackageBytes": 85132854,
  "completeForExecution": false,
  "missingForExecution": [
    "reviewed Linux target worker and dynamically linked ONNX Runtime installed-file evidence",
    "versioned Linux target operating-system sandbox evidence"
  ],
  "artifacts": [
    {
      "component": "pdfium",
      "version": "models-v1-linux-x64-extracted",
      "role": "native_library",
      "target": "x86_64-unknown-linux-gnu",
      "installPath": ".pdfium/lib/libpdfium.so",
      "sourceUrl": "https://github.com/docling-project/docling.rs/releases/download/models-v1/libpdfium.so",
      "byteLength": 7621800,
      "sha256": "3019ad1cd6980e51d900bb9266f8980cb846cb8e0c1f6553c52a7a1626469020",
      "license": "BSD-3-Clause AND Apache-2.0 notices",
      "noticeId": "pdfium-chromium-8009"
    },
    {
      "component": "layout-int8",
      "version": "models-v1-layout-heron-int8",
      "role": "model",
      "target": "x86_64-unknown-linux-gnu",
      "installPath": "models/layout_heron_int8.onnx",
      "sourceUrl": "https://github.com/docling-project/docling.rs/releases/download/models-v1/layout_heron_int8.onnx",
      "byteLength": 68543846,
      "sha256": "5c7a4685c838b485069b81847f2c9330f7ffc488aefff7a8ceb7f7968c95e410",
      "license": "Apache-2.0",
      "noticeId": "docling-layout-heron"
    },
    {
      "component": "pp-ocr",
      "version": "PP-OCRv3-en",
      "role": "model",
      "target": "x86_64-unknown-linux-gnu",
      "installPath": "models/ocr_rec_en.onnx",
      "sourceUrl": "https://huggingface.co/SWHL/RapidOCR/resolve/main/PP-OCRv3/en_PP-OCRv3_rec_infer.onnx",
      "byteLength": 8967018,
      "sha256": "ef7abd8bd3629ae57ea2c28b425c1bd258a871b93fd2fe7c433946ade9b5d9ea",
      "license": "Apache-2.0",
      "noticeId": "rapidocr-paddleocr-ppocrv3-en"
    },
    {
      "component": "ocr-dictionary",
      "version": "PaddleOCR-main-reviewed-bytes",
      "role": "dictionary",
      "target": "x86_64-unknown-linux-gnu",
      "installPath": "models/en_dict.txt",
      "sourceUrl": "https://raw.githubusercontent.com/PaddlePaddle/PaddleOCR/main/ppocr/utils/en_dict.txt",
      "byteLength": 190,
      "sha256": "5662df9d2d03f0e8ca0d3b0649d6acbab904b6a14b3d3521463c71c37c668ce3",
      "license": "Apache-2.0",
      "noticeId": "paddleocr-english-dictionary"
    }
  ],
  "distributionArchives": [
    {
      "artifact": "pdfium-linux-x64.tgz",
      "target": "x86_64-unknown-linux-gnu",
      "sourceUrl": "https://github.com/bblanchon/pdfium-binaries/releases/download/chromium%2F8009/pdfium-linux-x64.tgz",
      "byteLength": 3681087,
      "sha256": "be513e8021a5bf8eb2116e00d78c3bacb82c5a02b3785156ae14fe5e33084385",
      "license": "BSD-3-Clause AND Apache-2.0 notices",
      "noticeId": "pdfium-chromium-8009"
    },
    {
      "artifact": "pdfium-mac-arm64.tgz",
      "target": "aarch64-apple-darwin",
      "sourceUrl": "https://github.com/bblanchon/pdfium-binaries/releases/download/chromium%2F8009/pdfium-mac-arm64.tgz",
      "byteLength": 3459591,
      "sha256": "b1f2f17c7432a9942514dda5094ee9822c743bdfd07e7187725efbd34fde941f",
      "license": "BSD-3-Clause AND Apache-2.0 notices",
      "noticeId": "pdfium-chromium-8009"
    },
    {
      "artifact": "pdfium-mac-x64.tgz",
      "target": "x86_64-apple-darwin",
      "sourceUrl": "https://github.com/bblanchon/pdfium-binaries/releases/download/chromium%2F8009/pdfium-mac-x64.tgz",
      "byteLength": 3620144,
      "sha256": "e0afb6905e97438a9159aaa5b6c4fe188d97a7e3be05dc4782422c3ca7e1ce1a",
      "license": "BSD-3-Clause AND Apache-2.0 notices",
      "noticeId": "pdfium-chromium-8009"
    },
    {
      "artifact": "pdfium-win-x64.tgz",
      "target": "x86_64-pc-windows-msvc",
      "sourceUrl": "https://github.com/bblanchon/pdfium-binaries/releases/download/chromium%2F8009/pdfium-win-x64.tgz",
      "byteLength": 3768924,
      "sha256": "c78a8cd51b48abafcb266d868e401afefda1d189aa01ebbe743dc1d144e06031",
      "license": "BSD-3-Clause AND Apache-2.0 notices",
      "noticeId": "pdfium-chromium-8009"
    }
  ]
}
